{
  "version": 1,
  "population": "all GitHub Issues carrying the bug label at 2026-09-02T01:29:50Z",
  "total": 34,
  "corroborated_with_merged_fix": 32,
  "unknown": 2,
  "records": [
    {"issue": 3, "pull_request": 27, "merge_commit": "7e7c851b2f9a41ce2741b389e1b7016b587d9bd5", "disposition": "included", "incident_id": "cil-github-issue-3"},
    {"issue": 4, "pull_request": 28, "merge_commit": "9ae9e3932095dd74bc8c568323531caaf15abaa4", "disposition": "corroborated_not_sampled", "incident_id": null},
    {"issue": 15, "pull_request": 30, "merge_commit": "92ee72cf3369d4d799ddaf55d09daf4a1a5165e4", "disposition": "corroborated_not_sampled", "incident_id": null},
    {"issue": 92, "pull_request": 95, "merge_commit": "72214e97fb18f72e214b82380e7228f6dce6f8a4", "disposition": "included", "incident_id": "cil-github-issue-92"},
    {"issue": 106, "pull_request": 108, "merge_commit": "55dda5f51532bd202445da3679e3e0bbdadac2af", "disposition": "corroborated_not_sampled", "incident_id": null},
    {"issue": 107, "pull_request": 117, "merge_commit": "8e316934813aea702437e4982210f314be24532a", "disposition": "corroborated_not_sampled", "incident_id": null},
    {"issue": 115, "pull_request": 116, "merge_commit": "4d7220539cdc1439c9a90317aaa8e246970250e1", "disposition": "corroborated_not_sampled", "incident_id": null},
    {"issue": 118, "pull_request": 119, "merge_commit": "4b708d6e13c836bff3fad59e5681339ea60f8089", "disposition": "corroborated_not_sampled", "incident_id": null},
    {"issue": 122, "pull_request": 126, "merge_commit": "cf2f6c14df2f145d521ebe9ce19da5b11c9da772", "disposition": "corroborated_not_sampled", "incident_id": null},
    {"issue": 124, "pull_request": 125, "merge_commit": "74027ae3b03e09d29e2cb4cf3d5216cd5a1a3b90", "disposition": "included", "incident_id": "cil-github-issue-124"},
    {"issue": 127, "pull_request": 128, "merge_commit": "35c713d67186e3288456c1f724223edb934bbf05", "disposition": "corroborated_not_sampled", "incident_id": null},
    {"issue": 129, "pull_request": 132, "merge_commit": "64ba66981a90757bf7cbfe2cf48e71517e58e36b", "disposition": "corroborated_not_sampled", "incident_id": null},
    {"issue": 130, "pull_request": 138, "merge_commit": "de73528891240667e10e7af52aa1810be55dec54", "disposition": "corroborated_not_sampled", "incident_id": null},
    {"issue": 133, "pull_request": 135, "merge_commit": "c469fccc108ae920ccaf8ffa9c93da680fa6d652", "disposition": "corroborated_not_sampled", "incident_id": null},
    {"issue": 134, "pull_request": 140, "merge_commit": "7764befb3439d0b830b5d3968f9a5e703a627e67", "disposition": "included", "incident_id": "cil-github-issue-134"},
    {"issue": 139, "pull_request": 141, "merge_commit": "7f7b96aae203e39039ea31e60a11329954baed36", "disposition": "corroborated_not_sampled", "incident_id": null},
    {"issue": 142, "pull_request": 144, "merge_commit": "64ec2d130d0905164d2268226724032947eeb7e1", "disposition": "corroborated_not_sampled", "incident_id": null},
    {"issue": 143, "pull_request": 145, "merge_commit": "3cef6f17bb1e633ea4682c0d60eb44e666ea5133", "disposition": "corroborated_not_sampled", "incident_id": null},
    {"issue": 146, "pull_request": 147, "merge_commit": "06c19449d7832ddab4ae865f752bfd3b5b14443b", "disposition": "included", "incident_id": "cil-github-issue-146"},
    {"issue": 148, "pull_request": 149, "merge_commit": "1a624c1003ef1bd5b82eb74aece7ff4f12cca048", "disposition": "corroborated_not_sampled", "incident_id": null},
    {"issue": 150, "pull_request": 151, "merge_commit": "234d3d9f0fd82ff18f4bbbe692d4d43df35406dc", "disposition": "corroborated_not_sampled", "incident_id": null},
    {"issue": 152, "pull_request": 153, "merge_commit": "49d89c523b5bd9ce51e13a4e2f4c875469712ada", "disposition": "corroborated_not_sampled", "incident_id": null},
    {"issue": 154, "pull_request": 155, "merge_commit": "85f0c66999ed656bd3537540512ec4c154d1945f", "disposition": "corroborated_not_sampled", "incident_id": null},
    {"issue": 156, "pull_request": 157, "merge_commit": "c9864e4491e4a123344973f94e9375134bd863b0", "disposition": "corroborated_not_sampled", "incident_id": null},
    {"issue": 158, "pull_request": 159, "merge_commit": "ebdce9b038d4874f92ff469d2cfb8a76b6c909d0", "disposition": "corroborated_not_sampled", "incident_id": null},
    {"issue": 160, "pull_request": 161, "merge_commit": "b49ffcd5259bab0103d472e06bf44e2be60dc98a", "disposition": "corroborated_not_sampled", "incident_id": null},
    {"issue": 162, "pull_request": 163, "merge_commit": "68ca74b129a2f048070e7ecf2c08e2b1d032945b", "disposition": "included", "incident_id": "cil-github-issue-162"},
    {"issue": 164, "pull_request": 165, "merge_commit": "0d7f8ff776d48853086ce52bc87945335cebacd9", "disposition": "included", "incident_id": "cil-github-issue-164"},
    {"issue": 166, "pull_request": 173, "merge_commit": "af3cf42d5a5f9d67360e0a020ce15d5a18580836", "disposition": "corroborated_not_sampled", "incident_id": null},
    {"issue": 167, "pull_request": 174, "merge_commit": "d04d1e290aec52bae5c8fe009f04e9acf0e77a6f", "disposition": "corroborated_not_sampled", "incident_id": null},
    {"issue": 168, "pull_request": null, "merge_commit": null, "disposition": "unknown_included", "incident_id": "cil-github-issue-168"},
    {"issue": 169, "pull_request": 175, "merge_commit": "542ce6b367f371550ecd866e2b53f6ced7088692", "disposition": "included", "incident_id": "cil-github-issue-169"},
    {"issue": 170, "pull_request": 176, "merge_commit": "a3f38960d514a91b404d42af8c2f7ca1a647ad3c", "disposition": "corroborated_not_sampled", "incident_id": null},
    {"issue": 171, "pull_request": null, "merge_commit": null, "disposition": "unknown_included", "incident_id": "cil-github-issue-171"}
  ],
  "additional_non_bug_label_ground_truth": [
    {"issue": 102, "pull_request": 120, "merge_commit": "b3e1b5663ef190ee5c16f63d2fed76b37e3bf858", "incident_id": "cil-github-issue-102", "reason": "local deadline bypass and merged fix independently corroborate the bug"}
  ]
}
